subreddit,selftext
Cooking,"I lurk here a lot and feel this would be the right place to ask. I learned how to bake basic breads like bannock and cornbread, but I was wondering if you can make an ""edible"" bread/flatbread/tortilla using only bean/potato flour, water and salt (something similar to pre-hardened hardtack). I only found an East Asian recipe involving only potato flour, but it also happens to use butter and an ingredient I can't pronounce but know I can't get in america without Amazon.  And this one: [https://www.happyfoodstube.com/mashed-potato-flatbread/](https://www.happyfoodstube.com/mashed-potato-flatbread/)  
But I don't think you can use exclusively potato flour and mashed potato.

Edit: an\* unleavened bread, ack"
Cooking,"I have some wonderful lamb that I'm going to grind up shortly for the pie, but it's not enough for the number of people being served. I have the option of doing ground beef along with it, or ground pork. Any expert pie makers who have a considered opinion?"
Cooking,"Tried to make baked asian tofu and soba noodles, the tofu turned out really well (nice and crispy on the outside, soft on the inside) and so did the matching sauce. But then I made too many soba noodles, so when I added them into the tofu and sauce, they absorbed pretty much all of the flavor except for ginger. Now I have good tofu but overly gingery soba noodles that are nearly inedible. :( 

The past few things I’ve made have ended up like this too. Pasta too peppery, veggies too mushy, etc.

Kinda feels like I’m going to mess up every single thing I make from here on out and I kinda don’t even want to try cooking anything anymore. Sigh.

(Sorry if this kind of post isn’t allowed, I just need to vent cause I’m getting tired of failing in the kitchen over and over and my family/people would just laugh at me if I voiced my frustrations to them)"
Cooking," I have no idea what sub is best for this question; if this needs taken down because it's not truly cooking related I totally understand. I did not want to post in r/organizing because the kitchen is SO specific. And plus I figure you guys have some pretty awesome knowledge about this!

I had a major undiagnosed medical problem for 6 years and am FINALLY myself again and am back in the kitchen, woooo!! I forgot how much I loved cooking and I also am kind of relearning what I knew before since it's been so long.

So now I am doing a mini kitchen revamp. Ours is essentially non-functional now and I hate cooking in it.  I have looked all over and seen about 57251956 different ideas on how to organize spices, utensils, oils, towels, etc. I realize everyone's kitchen is set up differently and everyone has a different way of doing things but I am just lost. We all have the universal basics though, right? Stove, fridge, countertops, cabinets, drawers.... 

What are your best kitchen organizing hacks/ideas?  Do you have a dedicated prep area? Do you use the idea of mise in place and if so, what elements of it do you use at home? 

Any type of advice you can send my way to help us create a more functional kitchen to enjoy cooking again would be so, so helpful!!"
Cooking,"So almost every morning have a couple Egg-in-a-hole along with some seasonal fruit.  I am getting tired of it and am looking for a new suggestion.  It has to be easy to make and high protein.  Eggs are great, or whatever else.  I kind of work with the philosophy of eat like a king at breakfast and like a Pauper for supper.  Just something easy and new."
Cooking,"I'm running out of ideas for work lunches.  I work 3 nights out if the week (12 hours a night).  I am not allergic to anything and I am not picky.  Although, I do not like peas in any form. Also, I am unable to broil or grill, unfortunately.  

So, cooks of reddit, what recipes would you recommend? 

Thanks in advance!"
Cooking,"Yall. Regardless of how much I trim my beef, I always end up with a fatty (I think) clear film sitting on top of my otherwise nice and hearty beef stew/ribs/etc. I try to skim it off throughout the process but never can do enough to rid myself of enough of it. To me, it takes away from the final dish and makes eating it greasier and less enjoyable. Whenever I put the remainders in the fridge I can remove the white globs amassing at the top, but would rather not have to deal with that and enjoy it while it's hot.

Can someone tell me what I may be doing wrong?"
Cooking,"I had made a chicken tortilla soup and it turned out great, but I have another carton of chicken broth and I’m too new to really know what to do with it. Is there anything besides soups?"
Cooking,"I was hoping for some advice on modifying the sauce in [this recipe I made for manicotti](https://cooking.nytimes.com/recipes/1016936-crepes-style-manicotti).  I loved the recipe and enjoyed the making of it, but my wife gets heartburn from heavily tomato-based dishes (particularly tomato paste), so I typically try to avoid tomato paste as much as possible, but I don't know if it can be totally skipped (or have something else subbed in) and it come out all right.  Would mixing in carrots and celery help, or going with fresh tomatoes instead of the cans of diced/paste?  Are there other sauces you would recommend for something like this?  I've thought about trying for more of an alfredo sauce, but I'm worried that it will end up too cheesy (crazy idea, I know) and I feel like it needs something else to round it out, since the manicotti are already stuffed with multiple types of cheese.

I'm pretty happy with the actual manicotti, themselves, but I'd appreciate any suggestions on the sauce, either minor alterations or completely different recipes."
Cooking,"I have a camembert with a use by date of yesterday. Can I safely eat it? Is there anything I can do with it like freeze it?

Edit: thanks for the advice everyone. I'll try opening and baking it tomorrow."
Cooking,"I recently bought some red delicious apples on sale today for a snack. However, upon cutting them open I realized that the stem part of the apple was infected with a fungus, as it was black/brown and shrivled with some white specks. I cut out those sections, but the apples flesh had a weird mealy texture. I was sad as fuck because these are normally my favorite apples, but I figured I would cook with them instead. Any sugesstions?"
Cooking,"I feel like every foodie out there has at least one food we know we shouldn't eat because it's processed/low quality crap but it tastes so good we just have to indulge every now and then. For me, it's American cheese. I know it's plastic it's not real cheese blah blah blah and yes I do eat other cheeses for the most part, but man, sometimes I just gotta have that plastic crap on a grilled cheese or thrown into in my mac and cheese recipe. Anyone else have foods like this?"
Cooking,"I'm watching the house &amp; the family left 12 or 14 eggs in the fridge that are going to expire in a few days. Is there something big I could make with all of them?

I don't eat single eggs that much anymore, I kindof got turned off cooking them. I keep finding that little white skeleton thing in them."
Cooking,I have twins who are just starting school (kindergarten) and I got Bento Lunchboxes for them. Do people have ideas of things I can make ahead of time and freeze to put in them?
Cooking,"So I cook a lot for me and my fiance, stir frys, spaghetti bolognese, pork/beef joints with full trimmings but next Friday im doing something a bit outside what've done previously a long post ahead but devil is in the details also im a brit, the meals going to consist of (btw I was born with near to none sense of taste or smell but apparently I cook good somehow) 

five chicken breasts cooked in hunters chicken sauce thinned with water with chilli flakes two teaspoons, paprika  powder two teaspoons added a squirt of sriracha I did this before with a pork joint six people all blunt as spoons enjoyed it lol so I did something right while experimenting 
In the slow cooker im going to be adding sweet potatoes, carrots and onions and a sweet potato mash I know thats potatoes twice but my fiancee wants to lose weight so im helping lol, my main concern due to having near no sense of taste is will the sweet potato sweeten up the sauce to much? And should I go with my gut and go normal white spuds in the slow cooker (diced obviously) and sweet potato mash?

Oh yeah im also doing a sweet sponge cake (packet mixture) with bae marie melted galaxy chocolate on top and custard"
Cooking,"What's the best Mexican recipe book you've used? Or if there's a website that you'd recommend that would be fine too, though I do love recipe books. I'm hoping for something that covers the basics and ideally has some more unusual recipes too."
Cooking,Any ideas on what we can use it for? We dont have an oven.
Cooking,"So. I want one. I have a regular pop up toaster that only does 2 items at a time. I live with just my daughter. SO when we want something baked, we have to turn on the whole oven which is often wasteful. But my question is. Why is there such a HUUUUUGE price difference in models? 

So advise me oh fearless reddit. I want a toaster oven, preferable convection. I want to be able to move it from counter to a shelf. It will not be living permanently on my small counter. I want it to be as cheap as possible without sucking. Any thoughts? Thanks."
Cooking,"Hey there!

So just over the Christmas period I was gifted a cast iron skillet which I intend on using. I've done a lot of research on cast iron so feel like I'm ready to put it to good use, but also still have a couple of questions.

So I know that cooking acidic foods can strip the seasoning and its best to only cook acidic foods if you have a large amount of seasoning. My skillet came pre-seasoned and I intend to season it again today, but would I be able to cook shakshuka for example in this skillet without it ruining the seasoning?

Also, while I am aware that steaks and burgers and the like are all great things to cook in a cast iron pan, I was wondering if anyone had any suggestions of vegetarian recipes that would be more suited to a cast iron pan?

Thanks in advance!"
Cooking,"I cook with my son whenever we can. He is still very young but I always try to involve him with simple tasks.
For example, he will cut the cheese in small cubes with his little knife to put in the sauce later. Or he will help sort out the beans or put salt here and there. He was so excited when I shown him a calf feet I was about to cook, he was so eager to eat it (until he actually tried ...).
I really don't want him to grow like one of those adults that can't cook for themselves and their families."
Cooking,https://youtu.be/rO8XFES3DUQ
Cooking,"Hoping you can help me, I've got some frozen ground beef/mince 5% fat (500g) which I'm defrosting later so that tomorrow I can make chili con carne (thats what we call it here in the UK) in the slow cooker.

Any tips for making a really tasty and spicy chili? I always feel a bit meh when I make it. Tried various recipes. I can deal with spicy, would normally put a load of birds eye chillis in as well as curry powder, hot paprika etc.

I'm not fussed about it not being traditional as I'll probably be throwing in some leftover rotisserie chicken and whatever else I can use up i.e. kidney beans, butter beans, sweetcorn, bell peppers.

Look forward to reading some of your responses."
Cooking,Saving pasta water is just throwing diapers at trash cans.
Cooking,"Bought a bag of this venison and decided to make a stew.

Now the meat i very thinly sliced and i don't want to overboil it so how long shoul i cook it for?"
Cooking,"My fiancee was told by her doctor that she needs to eat more fish (I'll not get into the details other than its a health reason). Problem is however she's always had a hard time eating any kind of seafood due to the taste and texture, fish and shrimp especially.

I want to be a good man for her, and especially more so since I want her to be happy and healthy (no one likes to be sick) so I want to cook her a meal that she can eat, that has fish in it, but she won't be able to tell.

Any help, recipes, or tips for masking fishy flavors, textures, etc. would be helpful and more than appreciated!"
Cooking,"For example: 
1. Ketchup +mayonnaise
2. Ketchup + mustard 
3. Mustard + mayonnaise
etc."
Cooking,"Hi guys, 

So I fairly recently moved to an apartment for school and my kitchen is great and all but my smoke detector is super sensitive and goes off anytime I try to hard sear any meats. I usually make steaks sous vide and finish with a hard sear on my cast iron. I don’t really do hard sears that often but I’d like to have the option you know? Any ideas would be greatly appreciated!"
Cooking,"Because I’m the guy seasoning some chicken for fajitas, reached for my cayenne out the corner of my eye and just put a bunch of cinnamon on my chicken. Sigh."
Cooking,"When i made cashew milk i had about 80% less pulp than i do with almond milk and not sure if thats just how it is  


I am using a vitamix"
Cooking,"I am making this japanese rice bowl that is cooked and simmered in dashi broth,soy sauce, sake and mirin. However the cut of pork i got has like. 70:30  meat fat ratio so i thought by simmering it instead of pan frying it to get the fat out and then pouring in the broth to simmeer.

What is the difference and which is better? Thanks!"
Cooking,"I have some leftover pork skin and I’m wondering what are some recipes that I can use it in. I know chicharrones is one, what else?"
Cooking,"I asked a roommate to grab some herbs to make pickles with and I don't know what happened between then and now but I have a few fields worth of herbs in my fridge now.  What are your favorite things to do with fresh herbs in large volumes?

Specifics: 3 bunches of dill, 2 big bunches of basil, and then a healthy portion each of rosemary, sage, and thyme.  I don't cook with fresh herbs a lot (too poor), so I'm in the dark here."
Cooking,"Hi! I have this creamy Koji sauce, I was wondering if I could use this instead of Koji granulars.

It's the cold mountain brand, they were just out of the granular version at the store. Attached pictures of the Koji cream sauce. 

Inserted a link below: https://nymtc.com/mtc-food-item/cold-mountain-creamy-shio-koji/

Ingredients: Koji cultured rice, filtered water, salt"
Cooking,"A while ago, I bought a pepper grinder off of Amazon that broke within 6 months. I am currently able to invest in a sturdier product and was hoping some of you fine people would have some suggestions. I prefer wood to plastic, and don't want a giant one either. 

Anyone have a pepper grinder that they love that has lasted them a long time? Thanks for any advice or ideas in advance!!"
Cooking,"I just made peposa for the first time because I saw someone mention it on another thread and oh my god black pepper can taste so good. For those unaware, do yourselves a favor and make this dish."
Cooking,"We recently moved into a new apartment that doesn't have a dishwasher. This has changed my cooking dramatically meaning I really try to be mindful of how many dishes I am using so clean up is not such a pain. I have always made everything I could from scratch. I've become more open to frozen/canned/prepared foods as a result of the never ending pile of dishes to wash everyday (I never would have touched some of these things). What are some of your favorite frozen/canned/prepared foods to make clean up easier? 

I have discovered canned beets taste good, as do many frozen vegetables. Also, I found out those pre-packaged salads that include the  veg, crunchy bits, and dressing often taste great and make preparation great.  Others?"
Cooking,"I'm going to try the ATK version of New York Cheese cake, but I don't have a stand mixer.  Last time I tried to mix something that thick, my hand mixer started to smell like hot insulation.  Can I warm up the cream cheese a little past room temp (\~80F) to make it easier on the mixer (or my arm).  How far can I warm the cheese?"
Cooking,"Pretty much the title. I’ve been given ~2kg of hazelnut meal, and have never used it before. I do a lot of baking, and definitely keen to experiment and expand my repertoire. I’d love some recipes if anyone is willing to share :-)"
Cooking,"Any killer meatloaf recipes out there? I want your good old fashioned beefy standard (ground beef, ketchup, onion), and everything I’m finding has cheese or bbq sauce.

My mom used to make meatloaf, and it’s always been a favorite. I really want to make some with mashed potatoes this weekend, but I hate the idea of having to test 5 or 6 recipes to find a decent one (especially since I’m single, and that’s too much beef)."
Cooking,"Making lasagna right now. Noodles from scratch. Sauce from scratch. The whole 9 yards. 

I forgot to cover the dish and its been over 30 minutes. 

Is there really anything wrong that can happen for my sweat and tear-filled dish. 

And how can I tell if my noodles are finished cooking?"
Cooking,[Here](https://reddit.com/r/recipes/comments/d8whor/after_8_years_of_failures_tweaks_etc_i_have/) is the recipe I shared a couple months ago. Having made it again today I am absolutely in love. Enjoy on these cold winter nights! Thank you all for the cooking knowledge you kindly bestowed upon me!
Cooking,"My husband has requested empanadas with chimichurri sauce. So I'm planning to make basic beef empanadas but I figured while I'm at it, I'll make a variety and freeze for quick lunches/snacks later. What are your favorite fillings? 

Also, should I make my own dough or store bought?"
Cooking,"My roommate and I made meatloaf last night. Mainly savory or umami flavorings, no ketchup or milk, just eggs, garlic, sautéed onions, unseasoned bread crumbs, 1 teaspoon fish sauce, dash of Worcestershire sauce etc.

Then we cooked it with two strips of bacon on top, and at the end we glazed it with a mixture of aged balsamic vinegar and brown sugar. Just enough balsamic to dissolve about two tablespoons of brown sugar. It was amazing.

Anyone else tried this?

Edited for punctuation."
Cooking,"I have been using Diamond Crystal Kosher salt for years, and suddenly in the past couple of months, it is suddenly not available at any stores in my area. I have been to probably 20 or more grocery stores, walmarts, targets, and any other place I could think may have it in stock. No one has stock, and either the shelf spots are no longer there, or have a ""temporarily unavailable"" tag on them.

I did see that there were rumors about 1 year ago that they may discontinue it, but they were quickly squashed by the makers. 

Is any one else running into this issue? I have today conceded defeat and purchased 3 boxes from Amazon."
Cooking,"I'm looking for recipes or ideas for light German fare. The majority of the German culinary lexicon is very hearty and I'm looking for ideas for some lighter, ""summer picnic-esque"" dishes that maybe aren't so heavy. Hot dishes aren't out of the question, but I'm looking for dishes that aren't overly rich or fatty. Any input would be appreciated. Bring on the ideas!"
Cooking,"So I have a lot of leftover speghetti noodles from the other night. Obviously, we dont want them to go to waste. We dont have a lot of sauce left. Anyone have a delicious way to prepare leftover noodles?"
Cooking,"I decided to make an amaretto semifreddo and while the main body is soft and white, there is a layer at the bottom that's a different type of ice and is brown.

I whipped up some heavy cream (about 500mL) with a tablespoon of sugar first.  I then whipped 5 eggs and 1/3 cup of sugar until 3/4 done.  Put in 2 tablespoons of amaretto.  Then I continued mixing until stiff peaks.  Once I had stiff peaks, I folded in the heavy whipped cream.  Froze in glass container.

I can't tell if the layer at the bottom is amaretto that's frozen or if my whipped eggs separated.  

The whole thing is delicious though.

Any advice?"
Cooking,"I'm going to do a some venting, so please bear with me. TL;DR at the bottom. 

My husband and I have been together for 10 years. I can count on two hands the amount of times he has actually prepared and cooked us a meal. I do love cooking, and I've become good at it. He isn't bad by any means, and I've really enjoyed all the meals he has made.

I'm growing increasingly frustrated with his lack of help in this area. He won't clean any part of the bathroom because he has a ""thing"" about germs; he won't take the trash out for the same reason; he doesn't take care of the cats because that was our agreement for getting them (it was); he won't take care of the dog for reasons unknown; he won't do any cleaning of the fridge or sink; and he won't cook because his reasoning is that I like to do it. 

Don't get me wrong, he does clean. He declutters, vacuums, sweeps, mops, does the laundry including mine, and is responsible for doing the dishes after dinner, among other things, but I don't know that he realizes what a chore it is sometimes to cook after a long day. I asked him to make dinner the other night after a particularly long day and he declined. It was literally just tacos and took me less than 30 minutes start to finish, but he said that I'm ""better at it"" and like cooking (so clearly I must want to every day)? I tried to explain what a luxury it is to be able to relax from the time you get home til when you go to bed while I'm in the kitchen for anywhere from 30 minutes to an hour and a half, but he doesn't really get it.

Finally today (which is actually our anniversary) he asked if I wanted anything on his way home and specified he wasn't picking up dinner because I should really cook since I had a day off. For reference, the reason I had a ""day off"" was because someone broke into my car and shattered my windshield, so my ""day off"" was filled with police reports, taking myself to get my window replaced, and then working from home in between.

TL;DR I am really, desperately in need of very, very quick recipes. Like under 30 minutes. He will not eat leftovers. He will not touch anything that's been reheated. He doesn't like soups or stews except chili because he doesn't like his food all mixed. He also will not eat mushrooms."
Cooking,"Thanks to this sub last week I managed to cook a really tasty ratatouille, and I’m after another dish to cook for my girlfriend tonight when she gets home for work.


Any recommendations?"
Cooking,"Why are oil marinated olives almost always sold per pound in the store, at the olive bar, but not in jars or cans?

I've seen them once in a while in small trays in the stores, but never in larger quantities like regular olives, and never with the same amount of selection."
Cooking,"I guess I usually cook them for four minutes or so, enough to sear each side."
Cooking,"Hi, I'm hungry and was wondering what's the easiest and the least ingredient to cook tofu?

I found one on the freezer.  I have the usual onion/garlic/spring onion stuff/eggs.

What can you recommend? thanks in advance.

&amp;#x200B;

Edit: Thanks everyone.  It was ok.  lol.  But I know what to do next time thanks to all the tips."
Cooking,"Hey guys!

Disclaimer: I'm fairly new to cooking so bear with be please.

A few weeks ago I made a butter chicken dish that was ok but it was unbearably hot. The recipe I was following called for kashmiri chili powder, which I did not have. None of the grocery stores near me carried this pepper so I went googling to try and find a substitute and I read somewhere on a blog that you can substitute 1:1 cayenne powder for kashmiri chili powder. I don't think this is true because the dish was very hot and did not taste anything like the butter chicken I'm accustomed to eating at restaurants. Are there any viable substitutes for kashmiri chili powder? Thanks"
Cooking,"This is a long shot, I know. But a few years ago, my husband and I read an article in lucky peach that we didn’t realize was fantasy. It was about finding a hidden restaurant I think on an island with a chef—the descriptions of the food and these fantasy ingredients was so magical. It was so captivating and it wasn’t until the article ended that we realized it wasn’t a real place. I want to say the chef was Asian. There’s a chance it wasn’t in Lucky Peach but I feel about 80% sure it was. Thought it was worth a shot in the dark...

Some more details: my husband and I both remember the fictional chef as being Asian, he’d worked in a lot of restaurants and the author had to travel to find him. He was underground, had to go through a tunnel to get to his restaurant.

Could also be mcsweeneys. Year was around 2013. It was printed in a magazine.

UPDATE!: found it!! My husband wrote the editor Peter Meehan thinking it was a long shot and he not only responded BUT HE WROTE THE ARTICLE! It’s in the Chinatown edition of lucky peach and he’s going to send it to us. I’ll post here once that happens.

UPDATE 2: here is the article. He sent us a PDF of the whole magazine so I had to extract the pages and put them in imgur. Hope you enjoy! It was definitely the most wonderful when I initially read it as real:
[The Mother of all Cuisine](https://imgur.com/gallery/Pa3Niqk)"
Cooking,"Personally my favorite is Matty Matheson. You can tell he's professionally trained, but I end up cracking up laughing the whole time. I had never normally cared much for cooking prior. His facial expressions, random things he says, etc. are just great.

&amp;#x200B;

 [https://www.youtube.com/watch?v=zZ9SZn7QzIM](https://www.youtube.com/watch?v=zZ9SZn7QzIM)"
