subreddit,selftext
Cooking,This just happened. I put it back on the pan for 20 seconds or so when I realized. Can I still eat the chicken?
Cooking,"Hey, I don't know if this is the best subreddit to ask this so don't hesitate to link me something more fitting if this is not right.
I really enjoy mindless cooking/baking compilations like So Yummy and Tasty but I despise content farms like these. I wanted to know if anyone knows some good Youtube channel with honest creators that do something smiliar. Without commentary, if possible. Only cooking for the sake of watching cooking."
Cooking,"I love mayonnaise, however I have a relative who does not. Is there something that sort of gives the same flavor and texture?

I don't think JustMayo is worth mentioning. I believe I had it once and it tasted like crap. However, I am going to give it another try."
Cooking,"Hello, I'm on my second attempt on making sourdough starters.

On both my attempts, I start with 20gr water 20gr flour on day one, discard about half and add 40gr water and 40gr flour on day two, and keep adding about 1tbsp flour and water every morning


The first one fails after about day 5, with about 3ml layer of hooch, smells bad (vomit inducing) , and almost no sign of bubbling. Granted I didn't know it was hooch and that you need to discard it. I threw attempt one since I can't revive it. 

My current batch (attempt two): on day one there's a little bit of clear water layer after 12h.I just stir it back in. On day two, about 6h after feeding it triples in size! On day three, I notice it looks like it's not active. when I open the jar, I can feel the air rising up to be quite warm, which I thought must be normal. There's a little bit hooch, and it smells like acetone (which worries me) . I discard the hooch and the top layer of the starter, added 40gr flour and 40gr water, and about 6h later, there's almost no change in size, with a little bit hooch. It smells acetone, but doesn't feel vomity

What causes my really active sourdough to be so active on day two, but don't seem to maintain its vigority?"
Cooking,"For many home cooks, their stoves are simply not as hot as a proper kitchen wok stove, thus its very difficult to get the same results when cooking at home and in a kitchen. But when cooking kway teow noodles is it possible to use a blow torch to get the same smoky flavour as a proper wok?"
Cooking,"So I recently finally bought a beautiful 5.5 LC Dutch oven and its incredible! I’ve made so many dishes in it already. Can’t believe I went so long without one. 

Unfortunately I live in a small tight city apartment so I am limited but at the same time I’m itching for a 3.5 LC braiser.

I was wondering if anyone here has any experience with braisers in thoughts about owning one.

Would you recommend one over other pans like a cast iron?"
Cooking,"I like instant oats just as much as regular oats, any other instant food recommendations ?"
Cooking,"I found this receipe  [https://redandhoney.com/homemade-vegetable-broth-dry-mix/comment-page-1/#comment-392625](https://redandhoney.com/homemade-vegetable-broth-dry-mix/comment-page-1/#comment-392625)  and it uses dehydrated veggies, i noticed some of the same veggies are also used for the spices  


If a veggie is a spice does that make it very different than the actual untouched veggie?

  
I also found another receipe that used dried shrooms, if i ground those and used them along with this recipe would that ruin it at all?"
Cooking,"I bought a bottle of dry sherry for use as an ingredient in a tiger prawn risotto last week. Most of it is still left over. 

Other than making the same recipe to the point of boredom, is there any other main courses I could make using it is an ingredient? I've never seen it used in other recipes in the same way as wine or ale."
Cooking,"Hello folks,

For the first time ever I bought some imported red rice and tried cooking it the same way I always do with Thai rice:

- put rice in a glass container
- mix in some chopped vegetables
- add water until covering everything
- add seasoning
- mix everything
- put inside a vapor cooker
- cook for 25 mins

However after 30 mins the rice was still hard. I've added more water, and cooked for 20 minutes more. The rice was softer but still not quite how I like it.

Is this how the red rice is supposed to be?"
Cooking,"I've tried looking it up online and following the directions, but I can never quite get that fluffy consistency you get with a take out pizza. Is there some secret in preparing the dough to get it this way? Thanks!"
Cooking,"I have a few jars of cream of coconut, the sweeter sister of coconut cream. Is there anyway I could use this in a curry? I'm planning on having an incredibly high spice level, would this counteract the added sweetness?"
Cooking,"Firstly I start with the things nobody cares about. I do most of the cooking in my family (male, just like eating good food. Mom and your hamburger helper can take a seat). Been really into soups lately ( for obvious reasons). I actually make some damn good soups, make my own stock and all.

Recently decided to try something different and make a French onion soup (almost an hour of stirring onions just to prep, shoot me). Turned out great except for one thing. It was really sweet. I'm not a big fan of sweet things. No French onion soup I've ever had before was sweet like that.

Now I'm looking to you amazing people to help me out. Was it the onions? Was it the sugar the recipe called for? Can I leave the sugar out and let the onions caramelize in their own sugars?

I used yellow onions and 1tsp of sugar as directed (I don't usually follow recipes, they're just guidelines to wellness). I can link the recipe if needed. Thank you all in advance and if any additional info is needed I'll make an edit."
Cooking,And it’s because I realized too late that my yeast is unusable. Is there any way I can salvage it? I don’t want to throw it away.
Cooking,"My family and I love Moroccan food, and I am shopping around for a Tagine so I can make authentic recipes. Does anyone have a recommendation for a specific Tagine? I see handmade terra cotta that requires special care, at an affordable price, cast iron Tagines at an expensive price ($200+), and ceramic Tagines which seem to be only for serving food not for cooking. I admit I am new to this, but not intimidated. I just want to cook what I have only tasted in a Moroccan restaurant. Also- I am trying to feed 4+ adults. Thank you!"
Cooking,"Hi all, 

I just got this pan: [https://www.amazon.com/gp/product/B003YKGS4A/ref=ppx\_yo\_dt\_b\_asin\_title\_o04\_s00?ie=UTF8&amp;psc=1](https://www.amazon.com/gp/product/B003YKGS4A/ref=ppx_yo_dt_b_asin_title_o04_s00?ie=UTF8&amp;psc=1) 

I'm making a pan pizza tonight.  I have a baking stone underneath, and it's not a full Chicago-style pizza, just shooting for nice golden buttery crust.  Should I par-bake with this pan or just go straight in with topping?

Thank you!"
Cooking,"I recently moved into a new apartment and my parents gave me their spare little melting pot. It looks like it's 100% copper, which I'm sure is great for heat conductivity but I wonder if it's safe. A little bit of copper is fine but I know it can cause physiological damage if you're exposed to it over time. Is unlined copper safe to cook with? Or should I invest in a steel or lined copper melting pot?"
Cooking,Was cooking today using a Teflon pan and my gf said that’s it’s not a good idea if it’s scratched. Did some googling and it looks like there may be dangerous chemicals released when the Teflon gets scratched. How bad does the pan need to be scratched for it to be a concern? Also is it really that big of a concern?
Cooking,"I LOVE lamdshire sandwiches


https://www.amazon.com/Landshire-Chicken-Salad-Sandwich-Wedge/dp/B00E0S9H20

I’m looking to start making my own because they’re overpriced. The thing is there’s no other bread I’ve ever had that’s so “cheap” in that it seems like it’s comprised mostly of air and is insanely soft."
Cooking,"Hey all, new to this sub and newish to cooking. I want to attempt Chicken Suprême and I’m planning on buying and breaking down a whole chicken. Does anyone have a fantastic “elevated” chicken soup recipe that I can use the chicken carcass and rest of the cuts to make?"
Cooking,Title says it all. Looking to cook some chili. I have a recipe that doesn’t use beans (I don’t like beans) and was wondering if I could just add corn into my slow cooker with the chili instead of using beans. Free styling the recipe somewhat. Thank you
Cooking,I’ve recently had to make some changes in my diet and I can unfortunately no longer eat meat. I want to start cooking tofu and incorporating it into more recipes. What’s the best way to go about this?
Cooking,"I feel like we get a lot of questions about what to keep on hand in your pantry/fridge so I wanted to share six of my go-to pasta sauces (plus a couple more that I don't like but maybe you will) which can all be made with 11 ingredients that are really easy to keep around. All of these recipes come together in like 20 minutes and are almost impossible to mess up.

#The Ingredients

1. **Whole peeled canned tomatoes.** The best tomatoes are generally what end up whole in the cans plus they don't have any firming agents that can keep them from cooking down nicely. imo no point in springing for San Marzano most of the time. I'd recommend Muir Glenn in the US or Mutti in Europe. Keep a few cans around always—obviously they're not going bad anytime soon.
2. **Tomato paste.** The tubes are handy if you'll be using little bits somewhat frequently. I think ATK recommends Cento for this one in the US. I use Mutti again in Europe.
3. **Garlic.** It's garlic. You know the deal. Keeps for a couple weeks at least somewhere cool and dry.
4. **Yellow onions.** Yellow onions are mildest and best for cooked applications imo, but feel free to use white or red if that's how you get your jollies. Also keeps for a couple weeks.
5. **Shallots.** Even milder than the yellow onions. In a pinch, you could use onions in all the recipes that call for shallots. Or shallots in all the recipes that call for onions if you've got that Rockefeller money *Also* keeps for a couple weeks.
6. **Lemons.** Nothing fancy needed. Just plain old lemons. If you like the zest, maybe spring for organic. They keep a week or two in the fridge.
7. **Heavy cream.** Heavy cream or heavy whipping cream both work—just make sure it's not sweetened. Generally lasts about two weeks.
8. **Parmigiano reggiano.** Get the real stuff in its whole form—no ground up shit. It can be DOP if you want but doesn't have to be. There's plenty of great parm out there that isn't DOP-certified (but none of it it sold by Kraft). I personally prefer a 24-month most of the time, but a more complex 36-month has its charms too. It'll last quite a while wrapped up in the fridge.
9. **Pecorino romano.** Another grating cheese, but quite different from parm in flavor. While parm is more about nutty umami, pecorino brings more saltiness and a hint of tang. I'm probably in the minority here, but if both cheeses were in a burning building and I could only save one, I'd save the pecorino. You *can* substitute them for each other in a pinch but, like I said, they're not all that similar.
10. **Guanciale or pancetta.** Guanciale can be challenging to find outside of Europe, but it's worth the effort to track it down. (I think you can even order it on Amazon). It's fattier, sweeter, and milder in flavor than pancetta, but pancetta is much easier to find so you can sub that if needed. You can freeze either for quite a while. Just cut into thickish slabs (roughly ¼"" or 0.5cm) and separate with wax paper then keep it in the freezer. You can cut it into lardons straight from the freezer (it's way easier that way actually) and use it without thawing.
11. **Vodka.** Alternative uses: getting you drunk. Lasts forever.

I'm also assuming that you have some real basics on hand already. Namely salt, black pepper, chili flakes, olive oil, and butter. You'll need the actual pasta too. I recommend De Cecco across the board.

#The Recipes

1. **Basic tomato sauce/arrabbiata.** (Tomatoes, garlic, parm, salt, chili flakes, olive oil). My basic quick tomato sauce is actually based on [Serious Eat's arrabbiata recipe](https://www.seriouseats.com/recipes/2016/02/penne-pasta-arrabbiata-sauce-recipe.html). If you don't like spice, you can dial the pepper back as much as you like. This works with just about any shape. Penne's a classic, but casarecce might be my fave. Also great on [homemade gnocchi](https://www.seriouseats.com/2015/03/technique-fresh-ricotta-gnocchi-fast.html).
2. **All'amatriciana.** (Tomatoes, onion, pecorino, guanciale/pancetta, salt, chili flakes, olive oil). This is hands down the king of pasta sauces in my book. The pork fat takes everything that's great about tomato sauce and turns it up to 11 with minimal added effort. I use Marcella Hazan's recipe, which you can find [here](https://cookingfrombooks.com/2014/05/12/pasta-allamatriciana-2/). The only alteration I make is I render and crisp the pork first (starting in a cold pan) and *then* add the onions. idk why Marcella never seems to brown meat. Bucatini is supposedly the classic with this, but in Italy I've seen it much more with mezze maniche and I prefer it that way. That's a tough shape to find though, so you can sub something like rigatoni.
3. **Alla gricia.** (Pecorino, guanciale, black pepper, olive oil). Alla gricia is basically the midway point between all'amatriciana and cacio e pepe. Once again, I think the pork really improves on cacio e pepe. While it's fine to sub pancetta in the last recipe, I think this one suffers a bit more from the substitution. I recommend the [Serious Eats recipe](https://www.seriouseats.com/recipes/2018/11/pasta-alla-gricia.html). As with all'amatriciana, mezze maniche or rigatoni is the move.
4. **Cacio e pepe.** (Pecorino, black pepper, olive oil, butter). Is it as good as alla gricia? Despite being much more well-known, I'd say no. But sometimes you can't find guanciale or just can't be assed to render it. Cacio e pepe to the rescue. Once again, [Serious Eats](https://www.seriouseats.com/recipes/2016/02/spaghetti-cacio-e-pepe-recipe.html). Keep in mind that legit pecorino is very salty, so don't oversalt the pasta water. If all pecorino is too much for you, experiment with using part parm. Spaghetti is the way to go for this one.
5. **Alla vodka.** (Tomato paste, shallot, heavy cream, parmesan, vodka, salt, chili flakes, olive oil). Somehow this sauce hits all the exact same comforting notes as boxed mac and cheese (I mean that in the best way possible). I really like the [Bon Appetit](https://www.bonappetit.com/recipe/fusilli-alla-vodka-basil-parmesan) recipe. Fusilli is awesome with this, but the classic penne also works.
6. **Al limone.** (Garlic, shallot, lemon, heavy cream, parm, salt, chili flakes, olive oil). A break from the tomato-y cheesy porkiness. This is one of my favorites. I use the [Cooks Illustrated recipe](https://www.cooksillustrated.com/videos/1731-spaghetti-with-lemon-and-olive-oil-al-limone) (non-video is paywalled) but add some garlic, chili flake, and a bunch more lemon juice. I skip the zest and herbage. Use spaghetti for this one.

Finally, a couple honorable mentions: you also have all the ingredients here for **aglio e olio** and **alfredo**. I don't personally like either all that much, but I know lots of people go gaga over aglio e olio especially. Try 'em out if they sound up your alley. If you keep eggs around, you could also do **carbonara.** Again, not my fave, but you do you."
Cooking,I've never made curry before so I was looking for the easiest one to start with.
Cooking,"Chinese New Year is coming up.  What better way to celebrate than to cook and eat with family and friends.

I called up my mom and asked her for the recipe.

Dumplings

* 1 lb of ground pork
* 1 cup of cabbage (not nappa) diced
* 1/2 tsp salt
* 1 clove or garlic (minced)
* 6 scallions (whites cut up)
* 1 tsp sesame oil
* 2 TBSP soy sauce
* 1 tsp Chinese cooking wine
* 1 package of round dumpling wrappers (about 35-45 per package)

Dipping Sauce

* 1/2 cup soy sauce
* 1/4 cup Chinese Chinkiang black vinegar
* 1 tsp ginger (cut 2 thin slices into very thin strips)

&amp;#x200B;

Chop up the cabbage and put in a big bowl and mix in the salt.  Let it sit and wilt a bit.  My mom said that this makes it softer for mixing. Let it sit while you prep the other ingredients.

Combine the ingredients for the dipping sauce.  The ginger will infuse the sauce nicely. :)

Mix pork, cabbage, garlic, scallions, sesame oil, 2 TBSP soy sauce, cooking wine in a bowl until well combined.  Make a small meat pancake and fry it in a skillet.  Taste test and adjust seasonings.

Now it's time to wrap. Use about a rounded teaspoon of filling per wrapper. (YouTube has some really good videos).

To cook the dumplings:. Add about a 1/2 TBSP canola oil to a non-stick pan. Add the dumplings, one by one into the pan...make sure to rub some of the oil in the pan onto the bottom of each dumpling.  Add about 3 TBSP of water.  Cook, covered, on med to low heat for about 7 - 9minutes.  (I usually like to use lower heat in my cooking so that I don't burn my foods.)  Check to see that the dumpling skins look steamed through.  If not steamed through, and the pan is dry, add another TBSP of water.

Once the dumplings look steamed through, take the cover off and turn up the heat a little to crips the bottoms.

Plate the dumplings on a big plate and serve with the ginger dipping sauce.

Enjoy!

Happy Chinese New Year!  May the new year bring you health, prosperity and happiness."
Cooking,"Title is the post but basically Nordstrom carries the All Clad Immersion circulator and it’s on sale for a good price, plus as an employee I can use my discount.

[all clad](http://shop.nordstrom.com/s/5123404)"
Cooking,Thinking about drying them and grinding them into a powder but not sure what I'd use it on.
Cooking,"Years ago I found my [perfect steak seasoning](https://www.amazon.com/Steak-Williams-Seasoning-6oz/dp/B07P68B6TN) (local in Texas) but I can't find it on Amazon or in the stores any more.  I think one of the seasonings in it was celery seed.

Can anyone suggest a replacement with celery seed?

/corrected celery salt to celery seed"
Cooking,"Little clumps of chocolate swim around, no matter how hard I mix it. The same goes for when I try to make hot chocolate, tiny particles float around. What can ı do to solve this?"
Cooking,"I want to make a lemon meringue pie filling that I can cut into shapes (rectangles). In the past I've found that the pie filling is too runny to be able to hold a shape. 

What's the best way to have this hold up? Gelatin? I imagine pouring the filling into a rimmed sheet pan (probably 1/4 sheet) on a silpad. 

Any ideas?"
Cooking,"I’m making dinner for my dad tonight (chicken francese) and I’m serving roasted eggplant (sliced in rounds) as a side. I’m pretty positive my dad has never had it so I want to make it great. The problem I have with eggplant is that it sometimes stays floppy/soggy when roasted in the oven. When using those gigantic purple eggplants, I salt and sweat them for 30 min before roasting. Tonight I’m using a graffiti eggplant I got from Kroger. I’ve heard this type doesn’t need to be salted/drained before cooking. Is this true? How can I make sure the surface of the eggplant gets pleasantly crisp? Usually I brush (try to do so lightly) with olive oil, season with salt and pepper, and then roast on a cookie sheet or other shallow pan for 30-40 min, flipping roughly halfway through. Is there anything I can do to help my eggplant crisp up?

Thank you!!!"
Cooking,"Looking for a good recommendation for a toaster oven.  I want it deep and wide enough that I can cook a 12"" pizza and high enough that I can roast a small chicken.  I would also like it to have a  convection function."
Cooking,"Hi Reddit! This is my first post on this sub but I need help from you guys who actually know how to cook well.
I'm from the UK and my partner from South Korea is coming over for the first time in 2 months for a few weeks. If you guys didnt know it's VERY expensive in South Korea to buy fresh ingredients such as meat, vegetables and dairy and there's little chance to try non-Koreanified Western food. My partner is very excited to come over to the UK so that we can cook fresh meals together to save some money for other travels (The UK is quite cheap for groceries). He knows I'm still learning how to cook and I have a few basic dishes I can whip up and some of my other cooking I'd eat myself but I don't feel confident cooking for other people.
I want to surprise him and learn some new recipes before he comes! Preferably Western cuisine he can't get over there (although pretty much anything non East Asian would be fine). I also just need to learn to cook in general.
I'd really appreciate some advice on cooking for a noob like me and some recommendations for easy and impressive recipes and some kitchen basics eg what essential spices would you recommend me to have? (Where I live we have standard British supermarkets, Eastern European markets, Chinese markets and a Middle Eastern supermarket). If you were having Western food for the first time what would you want to try? I've been scouring the All Recipes app all morning but I can't tell the difficulty and I don't trust Pinterest after bad past experience :/

Thank you!"
Cooking,I know that the best is really to make it yourself but I am a college student so it is just so much easier for me to have the sauce on hand for when I really just need to satisfy that craving!
Cooking,Im making a sort of marinara sauce. And i think i added too much olive oil its kinda sepretaing in the pan. What do i do. Also how do i know when its done it already looks really dense and its been like 5 mins. I used half of an onion 4 cloves of garlic and a 400g can of tomato pulp. Mutti mai vista una polpa cosi. help!!
Cooking,"I realize it isn't peak Reddit time, so I'm probably going to have to figure this out on my own. But I've slightly charred the soup part of a big batch of chicken and dumplings (fried my alliums to the bottom while cooking the dumplings-d'oh!) Thankfully I was cooking the dumplings in the broth first to store separately, so the veggies and chicken are unaffected. 


My question is this: is there any way to save the broth? It only tastes slightly charred, it's not strong at all but it is noticeable. I'm ideally looking for something I can add that will hide the burned flavor while still tasting like a proper thick chicken soup."
Cooking,"If anyone is having second thoughts about weird looking fungus, let me settle your doubts. Having come from a poorer upbringing with unhealthy parents, I've been closed off to the world of vegetables that are not frozen peas/carrots/potatoes. Since moving out a few years ago, I've been eating significantly better and exploring what's out there slowly. Let me tell you what, I bought Shiittake mushrooms the other day and had an eye opening experience I will never forget.

I cooked them in olive oil, garlic and balsamic vinegar and thought I was in heaven. I meant to post a picture but I ate them too fast. If anyone has other recommendations as far as recipes with them, I would love to know. They're going to be on my grocery list forever."
Cooking,"I'm looking for inspiration! All my family and friends know I enjoy cooking (and especially baking), so for Christmas and birthdays I often get gift cards to my local kitchenware shop. Grateful as I am, the problem is I'm now at the point where my kitchen is pretty well stocked, so I'm running out of ideas and the gifts cards are accumulating faster than I can spend them.

It's a good opportunity to replace my cheap electric hand mixer with a fancy one (KitchenAid maybe), and I'd still have a fair amount left over for some fun stuff. Or I could spend it all on something cool and expensive, but I've already got the obvious big-ticket items, like a stand mixer, casserole dish, etc.

So let's get super indulgent: how would you spend big money at the kitchen shop? Would you get into making your own cheese or ice cream? Upgrade all the old utensils? Get yet another gorgeous bundt pan or serving platter? Le Creuset oven mitts? A few grams of saffron or powdered vanilla? Bring me your ideas!"
