subreddit,selftext
Cooking,"I have been learning how to cook over the past year. people tell me I have gotten pretty good at it. my fiance' is super appreciative and loves everything i cook. problem is, i hate everything i cook. i find it repulsive. it could be the best tasting thing i've ever made, and i'd have no interest in it. it's starting to depress me, because i spend so much time and money on these dishes that my fiance' will eat from for days, and all i can do is watch him eat it. when i finally go out of my mind from hunger, ill just go to McDonalds and eat chicken nuggets. if my mom or someone else makes food, i'll usually enjoy it. i just can't seem to get past this psychological barrier and i've never been more unhealthy and hungry in my life.

has anyone else ever experienced something like this?"
Cooking,"Maybe this is about cooking. Maybe not. Since cooking is such a personal emotional thing for many of us I'll take the risk. Let me know if this doesn't belong here.

I have said the final farewell to all of my grandparents and my parents. When they died we all sorted through their belongings and chose a few things to keep. Most of my selections were from the kitchen. My mom's mom provided a pastry blender. My dad's mom a little screen sieve. My mom provided a few items, the most special to me is a little aluminum measuring cup that she always had in the flour canister. Lots of memories came along for the ride with that measuring cup. It is now in my flour canister and I think of her every time I use it. It is still usually painful nearly three years later but I will always keep it in the canister. Tonight it was eggplant parmesan and the breading needed some flour. I both hate and cherish using it and am missing her a lot right now. I wish I could post a photo of that simple measuring cup in this text only sub; you'll just have to imagine it.

If there's a point to this post I suppose it is to encourage everyone to cherish and make time for the important things in life with people and cooking being at the top of the list.

EDIT I totally forgot about imgur. Thx for the reminder u/drunky_crowette.

Here's a link to a pic of the aforementioned measuring cup:  https://imgur.com/gallery/4Tqq5De

EDIT2 it seems cliche but I really did not expect such a big response to this post. I have two general comments. First, there must have been a really successful ad campaign mamy decades ago that persuaded the mothers of the day to use this specific cup for flour. I can't believe how many commenters have stated they have the exact same cup in their flour. Second, I suppose awards and karma are nice, but what is most meaningful to me is how this post has connected so deeply with so many people and in some cases helped them move forward a bit in their grieving process. It has been healing for me to see that happen. ❤"
Cooking,I typically save several dollars every trip to the grocery store. What name brand do you refuse to substitute for store brand?
Cooking,"I eat a lot of steamed vegetables, particularly broccoli, cauliflower, brussel sprouts, and asparagus. It is fast, healthy, and doesn't heat up my apartment in the spring and summer (I do more roasting in the colder months). 
Usually I just finish them with a bit of olive oil, salt, and pepper, but this gets old. Any ideas?"
Cooking,I currently own both a Crock Pot and an Instant Pot but am looking to declutter and considering selling the Crock Pot. Is there anything that the slow cooker can do that an Instant Pot can’t? Any reason for me to keep both? TIA!
Cooking,"Hi all, a couple of hours ago I opened a can of Aldi supermarket tomatoes, and after breaking the seal by half an inch, the tomatoes exploded upwards, with a white fizz everywhere. The fizzing continued for about two minutes and has now settled. Obviously I haven’t consumed any, and had a shower to try and get any off me. What are the chances this was caused by the bacteria that produced botulism? And if so what are the chances of serious repercussions having not consumed any?

Thanks in advance"
Cooking,"I love curries, specifically butter chicken, paneer, indian and thai curries. What other sauce heavy dishes should I try?"
Cooking,The judges really seem to be into red meat and things to be a bit different. Me and my group are thinking about making lamb chops with a mint/coriander chutney but we can’t think of a good side to compliment it. The rest of our menu is very fresh and citrusy. Does anyone have any suggestions for a side. (We have one hour to cook).
Cooking,"It's winter where I live. Cold weather and grey skies make up most days. I've been finding myself drinking too much coffee as of late and never feel like drinking tea. However, I'm very rarely not in the mood for a spicy, warm cup of chai tea. The thing is that I'm not too crazy about most store-bought brands of chai.

I decided to take matters into my own hands and make my own with spices from my kitchen. I've been doing it for a while now and figured I share how I do it with the world. I'll post the recipe below and a link to a how-to video for my visual-first people. Cheers!

**Masala Chai Ingredients:**

* Fresh ginger, 1 inch knob
* Cinnamon, 3 inch stick
* Black peppercorns, 5 whole
* Clove, 3 whole
* Green Cardamom, 4 whole
* Cane Sugar, 3 tbsp (45g)
* Assam or Black Tea, 1.5 tbsp (10g)
* Whole Milk, 1 cup (237ml)

**Technique:** [https://www.youtube.com/watch?v=Byr7HmdKOq0](https://www.youtube.com/watch?v=Byr7HmdKOq0)"
Cooking,"I stopped eating meat about 2 years ago and I'm completely happy with my decision. To get more protein, I've tried to incorporate more tofu into my diet, but I just can't stand the taste.

Usually people say tofu doesn't have a taste at all, but that's not the case for the tofu I've cooked. I'd be completely happy if it had no taste, because then you can completely change the flavour by marinating it differently. But for me, it just tastes bad. 

Am I just weird? Are there other people that just can't stand the taste? Did I just buy the wrong kind of tofu? 

I tried different cooking methods, I've fried it in oil, I've pan fried it, I've baked it, I marinated it with different things, and I was actually really impressed by how much you can change the texture and how much flavour you can pack in there, but the 'tofu taste' that J hatte still remained."
Cooking,I’m making my first ever batch of home made pasta and the dough is currently resting so I have 30 minutes to decide which will go better with home made pesto. They’re the only attachments I have for my pasta crank so which should I go with?
Cooking,"I've always been confused by the ""classic"" way of cooking pasta: Using lots of water, making it as salty as the sea, and then setting a bit of cooking water aside for adding it to the sauce. For me it made no sense. So I came up with my own way of cooking pasta. 

1) Using far less water. All noodles have to be covered of course, but adding a lot more has no benefits. They won't stick together if you stir from time to time. By using less water, you get a higher concentration of starches.

2) Not salting the water for the first 5 minutes (that is, if you use normal noodles with a cooking time of about 10 min) and reserving some of the UNSALTED pasta water. 5 min are enough for the salt to penetrate the noodles, you won't taste any difference. 

3) Adding most of the unsalted pasta water before and letting it further reduce in the sauce; this again increases the starch concentration. Still don't use all of your reserved water so you can regulate the consistency of the pasta with the sauce later, dry pasta is BAD."
Cooking,"Hello!

One of my most favorite recipes is [this fettuccine alfredo](https://www.recipetineats.com/one-pot-chicken-alfredo-pasta/)!
I make it for family and friends a lot, and they all really love it!

The biggest issue that I have though, is that the sauce isn’t creamy like traditional alfredo. Instead, it looks a bit like cottage cheese and causes the pasta to stick together a bit.
I’ve made this recipe hundreds of times, and it always turns out the same...

Is there anything that I could be doing differently in order to make the sauce more creamy? Or is this just how it’s supposed to look?
Thank you for the advice! It tastes delicious either way! :)"
Cooking,"About 5 or 6 years ago, I made some lamb rogan josh and ended up with far too much leftover spice rub. I didn't want to throw it all away, so I stuck it in a ziploc and labelled it. The problem is, rogan josh is not something I make often, so it sat there for a while until I started incorporating it in other dishes. Over the years, I've dipped into it and added things back in so often that I have zero idea of what is in there anymore, but it is many generations past anything resembling rogan josh.

I started doing this for convenience and thriftiness, but I feel like it has helped me become a better chef (even if the practice isn't very chef-like). Every time I'm considering using it, I'll smell the bag and try to figure out what's in it, and decide whether it will complement my dish or if I should add any leftover seasoning into it.

Am I the only one who does this? Do you consider this poor practice? What would you guess is in your mystery blend?"
Cooking,Any recipes? Tips? Tricks? Bean sprout eating nematodes?
Cooking,"I've noticed that it's one of those dishes that's common enough across the world that everyone has their own recipe for it. So, how do you elevate a weeknight, meal-prep stew into something that you can serve at a holiday party?"
Cooking,"I can go to the grocery store to get things, but it is a bit of a trek for me, especially in the winter months.

I have pickled tomatoes, mixed veggies, and hot peppers."
Cooking,"Fir Christmas my mother gave my kids a bunch of ""easy menu ethnic cookbooks"" a library was getting rid of.  They are great and kid friendly.  We tried the Cooking the Italian way last week and it was a huge hit.  We went all out made a 4 course meal and broke out the fancy dishes and came as close as I was able to create a true Italian table.  I would love to give the Japanese culture as much accuracy as I can as well, but I have much less experience with Japan and its culture.

We have a large low coffee table and I figure i can get us some pillows to sit on.  I ordered some chop sticks, I know they wont be able to use them, but figured it would be fun to try.   It says to use a variety of small dishes, I am a bit of a china ware horder, so that is doable.

The author of the book did not give me a simple menu, she says to just pick some of each category and chose thing with different flavors, but I really do not know what each food is going to taste like.  The menu I am going with so far is: 

Green tea, I cannot get loose leaf here

Basic Clear soup, I ordered Dashinomoto (this will be completely new) (O-sumashi)

Sesame seed dressing with Broccoli (Groma-ae)

Rice

Chicken in a Pot (Mitzutaki)  with soy sause/lemon for dipping and chives, ginger root for garnish

Anyone on here from Japan? Or of Japanese decent? Can you tell me if this is a close example of what might be ate during a nice meal with family?  Is there anything I might add (way out in the middle of no where, so it will be hard to get much but I would be happy to know for maybe next time)  My kids range from 7 to 2, but only the 7 yr is really picky, she will eat the chicken plain.
Oh and because the book does not specify, do you usually put out all the food at once? Or do you do courses?"
Cooking,I was just making a soup starting off by sweating a mirepoix in the pan to create a base of flavours. I then added vegetable stock for a further base of flavour. Why have both? Is it not enough simply to have the stock?
Cooking,https://www.gimmesomeoven.com/strawberry-banana-smoothie-recipe/
Cooking,"So I just started cooking with a Stainless steel pan almost everyday. I love it.

But, I noticed yellow grease stuck to the cabinets/ceiling the other day and It took me hours to clean it off. Yes, some splatter happens but it seems ridiculous that it's this bad. (I don't have a vent hood).

I just got a splatter cover today and have been using it but has anyone else noticed this? Or is it the vent issue?"
Cooking,"One of my bucket list goals in life is to create a cookbook with my fiancé for us to use and pass on to future generations. We’re mid to late twenties, and have found that most of our friends don’t enjoy cooking like we do. 

We have such a great time cooking together and discovering/trying new recipes, that I wanted to create a post dedicated to just that. 

Is there a favorite recipe of yours that you can share with us and the rest of the community? We would love to add to the arsenal, and are always looking for new ideas! Any and all recipes are welcome as we’re not picky. 

I’ll start the discussion with a recipe we really enjoy that my father came up with. It’s amazing and I highly recommend you try it (especially if you like a bit of heat). See below for the recipe, and thanks for sharing!

Spicy Salmon Burritos

Ingredients:
1 lb Atlantic salmon (or salmon of choice)
Tortilla of choice
Jezebel spicy spice seasoning
Olive oil
Pico de Gallo:
3 Roma tomatoes
1/4 white onion
1/8 bunch cilantro
1 jalapeño de seeded
1/2 lime
Adobo sauce:
1/4 cup sour cream
7 oz can La Costena Chipotles in adobo sauce
Salt

Recipe:

1. Put sour cream in small bowl
2. Add 1/2 can sauce ONLY from La costena chipotles (add more to taste for greater heat/chipotle flavor)
3. Mix together, add salt to taste, mix again, and place in fridge.
4. Dice the Roma tomatoes, white onion, and de seeded jalapeño and place in separate bowl. Rough chop cilantro and add to bowl. Squeeze lime juice into bowl, then mix together. Add salt to taste, mix again, and place in fridge.
5. Lightly coat salmon in olive oil, and coat lightly on both sides with the jezebel spicy spice rub.
6. Grill salmon for about 5-7 mins each side on high heat per inch of thickness, or until salmon reaches internal temperature of 145F and flakes easily with a fork. If baking, preheat oven to 450F and bake for approximately 12-15 mins. 
7. Place salmon in a small bowl and break up into shreds/small pieces with a fork, ensuring that seasoning from salmon is mixed throughout.
8. Remove adobo/sour cream sauce and Pico de Gallo 
from the fridge, and heat tortillas on stove or in microwave.
9. Place tortilla on plate, add salmon, then Pico de Gallo, and adobo/sour cream sauce to finish. Wrap ingredients in tortilla.
10. Enjoy!"
Cooking,"When do you guys usually season your ground beef when making crumble, before you cook it, durning cooking, or after draining?"
Cooking,I only have smoked turmeric and paprika. I am thinking of smoking my own I like the spice mixes like Harissa and Zaatar. I wonder how they would tasted smoked? I'm thinking fantastic!
Cooking,"So I made it a few times before with flour, milk, and some Cajun spice. Came out good, but I wanna try something new.
I’ve seen you can use crushed chips to make it or even beer. I’m just looking for some more guidance in this as I want to try something new."
Cooking,This just happened. I put it back on the pan for 20 seconds or so when I realized. Can I still eat the chicken?
Cooking,"Hey, I don't know if this is the best subreddit to ask this so don't hesitate to link me something more fitting if this is not right.
I really enjoy mindless cooking/baking compilations like So Yummy and Tasty but I despise content farms like these. I wanted to know if anyone knows some good Youtube channel with honest creators that do something smiliar. Without commentary, if possible. Only cooking for the sake of watching cooking."
Cooking,"I love mayonnaise, however I have a relative who does not. Is there something that sort of gives the same flavor and texture?

I don't think JustMayo is worth mentioning. I believe I had it once and it tasted like crap. However, I am going to give it another try."
Cooking,"Hello, I'm on my second attempt on making sourdough starters.

On both my attempts, I start with 20gr water 20gr flour on day one, discard about half and add 40gr water and 40gr flour on day two, and keep adding about 1tbsp flour and water every morning


The first one fails after about day 5, with about 3ml layer of hooch, smells bad (vomit inducing) , and almost no sign of bubbling. Granted I didn't know it was hooch and that you need to discard it. I threw attempt one since I can't revive it. 

My current batch (attempt two): on day one there's a little bit of clear water layer after 12h.I just stir it back in. On day two, about 6h after feeding it triples in size! On day three, I notice it looks like it's not active. when I open the jar, I can feel the air rising up to be quite warm, which I thought must be normal. There's a little bit hooch, and it smells like acetone (which worries me) . I discard the hooch and the top layer of the starter, added 40gr flour and 40gr water, and about 6h later, there's almost no change in size, with a little bit hooch. It smells acetone, but doesn't feel vomity

What causes my really active sourdough to be so active on day two, but don't seem to maintain its vigority?"
Cooking,"For many home cooks, their stoves are simply not as hot as a proper kitchen wok stove, thus its very difficult to get the same results when cooking at home and in a kitchen. But when cooking kway teow noodles is it possible to use a blow torch to get the same smoky flavour as a proper wok?"
Cooking,"So I recently finally bought a beautiful 5.5 LC Dutch oven and its incredible! I’ve made so many dishes in it already. Can’t believe I went so long without one. 

Unfortunately I live in a small tight city apartment so I am limited but at the same time I’m itching for a 3.5 LC braiser.

I was wondering if anyone here has any experience with braisers in thoughts about owning one.

Would you recommend one over other pans like a cast iron?"
Cooking,"I like instant oats just as much as regular oats, any other instant food recommendations ?"
Cooking,"I found this receipe  [https://redandhoney.com/homemade-vegetable-broth-dry-mix/comment-page-1/#comment-392625](https://redandhoney.com/homemade-vegetable-broth-dry-mix/comment-page-1/#comment-392625)  and it uses dehydrated veggies, i noticed some of the same veggies are also used for the spices  


If a veggie is a spice does that make it very different than the actual untouched veggie?

  
I also found another receipe that used dried shrooms, if i ground those and used them along with this recipe would that ruin it at all?"
Cooking,"I bought a bottle of dry sherry for use as an ingredient in a tiger prawn risotto last week. Most of it is still left over. 

Other than making the same recipe to the point of boredom, is there any other main courses I could make using it is an ingredient? I've never seen it used in other recipes in the same way as wine or ale."
Cooking,"Hello folks,

For the first time ever I bought some imported red rice and tried cooking it the same way I always do with Thai rice:

- put rice in a glass container
- mix in some chopped vegetables
- add water until covering everything
- add seasoning
- mix everything
- put inside a vapor cooker
- cook for 25 mins

However after 30 mins the rice was still hard. I've added more water, and cooked for 20 minutes more. The rice was softer but still not quite how I like it.

Is this how the red rice is supposed to be?"
Cooking,"I've tried looking it up online and following the directions, but I can never quite get that fluffy consistency you get with a take out pizza. Is there some secret in preparing the dough to get it this way? Thanks!"
Cooking,"I have a few jars of cream of coconut, the sweeter sister of coconut cream. Is there anyway I could use this in a curry? I'm planning on having an incredibly high spice level, would this counteract the added sweetness?"
Cooking,"Firstly I start with the things nobody cares about. I do most of the cooking in my family (male, just like eating good food. Mom and your hamburger helper can take a seat). Been really into soups lately ( for obvious reasons). I actually make some damn good soups, make my own stock and all.

Recently decided to try something different and make a French onion soup (almost an hour of stirring onions just to prep, shoot me). Turned out great except for one thing. It was really sweet. I'm not a big fan of sweet things. No French onion soup I've ever had before was sweet like that.

Now I'm looking to you amazing people to help me out. Was it the onions? Was it the sugar the recipe called for? Can I leave the sugar out and let the onions caramelize in their own sugars?

I used yellow onions and 1tsp of sugar as directed (I don't usually follow recipes, they're just guidelines to wellness). I can link the recipe if needed. Thank you all in advance and if any additional info is needed I'll make an edit."
Cooking,And it’s because I realized too late that my yeast is unusable. Is there any way I can salvage it? I don’t want to throw it away.
Cooking,"My family and I love Moroccan food, and I am shopping around for a Tagine so I can make authentic recipes. Does anyone have a recommendation for a specific Tagine? I see handmade terra cotta that requires special care, at an affordable price, cast iron Tagines at an expensive price ($200+), and ceramic Tagines which seem to be only for serving food not for cooking. I admit I am new to this, but not intimidated. I just want to cook what I have only tasted in a Moroccan restaurant. Also- I am trying to feed 4+ adults. Thank you!"
Cooking,"Hi all, 

I just got this pan: [https://www.amazon.com/gp/product/B003YKGS4A/ref=ppx\_yo\_dt\_b\_asin\_title\_o04\_s00?ie=UTF8&amp;psc=1](https://www.amazon.com/gp/product/B003YKGS4A/ref=ppx_yo_dt_b_asin_title_o04_s00?ie=UTF8&amp;psc=1) 

I'm making a pan pizza tonight.  I have a baking stone underneath, and it's not a full Chicago-style pizza, just shooting for nice golden buttery crust.  Should I par-bake with this pan or just go straight in with topping?

Thank you!"
Cooking,"I recently moved into a new apartment and my parents gave me their spare little melting pot. It looks like it's 100% copper, which I'm sure is great for heat conductivity but I wonder if it's safe. A little bit of copper is fine but I know it can cause physiological damage if you're exposed to it over time. Is unlined copper safe to cook with? Or should I invest in a steel or lined copper melting pot?"
Cooking,Was cooking today using a Teflon pan and my gf said that’s it’s not a good idea if it’s scratched. Did some googling and it looks like there may be dangerous chemicals released when the Teflon gets scratched. How bad does the pan need to be scratched for it to be a concern? Also is it really that big of a concern?
Cooking,"I LOVE lamdshire sandwiches


https://www.amazon.com/Landshire-Chicken-Salad-Sandwich-Wedge/dp/B00E0S9H20

I’m looking to start making my own because they’re overpriced. The thing is there’s no other bread I’ve ever had that’s so “cheap” in that it seems like it’s comprised mostly of air and is insanely soft."
Cooking,"Hey all, new to this sub and newish to cooking. I want to attempt Chicken Suprême and I’m planning on buying and breaking down a whole chicken. Does anyone have a fantastic “elevated” chicken soup recipe that I can use the chicken carcass and rest of the cuts to make?"
Cooking,Title says it all. Looking to cook some chili. I have a recipe that doesn’t use beans (I don’t like beans) and was wondering if I could just add corn into my slow cooker with the chili instead of using beans. Free styling the recipe somewhat. Thank you
Cooking,I’ve recently had to make some changes in my diet and I can unfortunately no longer eat meat. I want to start cooking tofu and incorporating it into more recipes. What’s the best way to go about this?
