subreddit,selftext
Cooking,"I'm looking to replace my ancient, rusted splatter screen.  

What are your thoughts on silicone vs stainless?

I use it with my cast iron for post-sous vide searing, bacon frying, tomato sauce, etc.

I put almost everything in the dishwasher, so that is important.

Which is the most durable?

Which does best at keeping the splatters at bay?"
Cooking,"Hello r/Cooking!

I am currently trying to bulk on a plant based diet and need some ideas   for proper seasoning and dressings to make this meal more enjoyable. Sadly, I am pretty unimaginative regarding cooking.

Ingredients:

* Sweet potato
* Quinoa
* Spinach
* Kidney Beans

Can you help me out ?

Thanks!"
Cooking,"So recently my girlfriend and I started taling care of our diet. We basically ate junkfood and sugery drinks and all the bad stuff all the time. We made a serious change and we follow a healthy balanced diet. We both lost weight already in the first two weeks which is nice! The problem however is the food we eat for dinner. Now to have a balanced meal we have 200 grams of vegetables, a small portion of carbs(rice, pasta, potatoes etc.) And a portion of protein. However so far the food we make is kinda boring and doesn't taste great. For instance we made salmon last night with potatoes and broccoli. Salmon was nice potato and brocolli were not that much. We avoid using most sauces btw. We both love food a lot and I was wondering if you guys had some tips or recipe ideas to make it easier for us to stick to this balanced diet."
Cooking,"I'm rubbish at cooking. I use a ready made mix so basically cook mince/onions.... add water and veg, mash potato with bit of butter/milk and done.

Is there something i could add to it to make it slightly better and a bit more creative but still use the mix?

Don't overcomplicate because i'm TERRIBLE. Want to start cooking in the next hour or two"
Cooking,"There is something about hitting an onion in my food that I HATE.  

Onion powder?  Yeah, we’re cool.  Any form of any onion that still holds its flavor?  Not so much. 

I understand how much the flavor of onion is important to cooking and when I use powder I don’t mind but any other form of onion makes me want ban them from existence.  It’s partially texture related but really there’s something about the intense onion flavor hitting me at once that really turns me off.

There has to be a way for me to dip my toe into the onion pool and work my way up to eating them raw, right?  Surely someone has been through this and can help me."
Cooking,I've never cooked Osso Buco a.k.a. Veal. I know that you supposed to let it simmer in a sauce for a few hour but i didnt make it like that cause im just testing it. Anyway im making a simple roast like meal just some potatoes with veggies and the veal in the oven to cook since I heard it can be tough if you dont cook it slow. But did I mess it up? Like will it still be tough since its just by itself in the oven?
Cooking,"I see Cento is in a [class action lawsuit](https://topclassactions.com/lawsuit-settlements/consumer-products/food/880933-cento-fine-foods-class-action-says-san-marzano-tomatoes-misrepresented/) about marketing their tomatoes as ""San Marzano."" But that aside, when I use their ""Find My Field"" tool, it seems the tomatoes legitimately come from farms in the Mt. Vesuvius region of Italy (assuming the tool isn't rigged).

Why doesn't Cento seek true D.O.P. certification for their San Marzano tomatoes? Could it be their way to keeping costs down? Or are they unable to get certification (I noticed the fields are often adjacent to a populated road or highway so maybe air quality plays into it)?

FWIW, I recall reading somewhere that actual D.O.P. tomatoes exported to U.S. supermarkets are all Grade C, and that the ""good"" crops are kept by the Italians and/or are only accessible to purchase by restaurants.

**My own opinion:** I often find Cento tomatoes to be a bit ""brighter"" in taste than actual D.O.P. tomatoes from brands like Sclafani or La Fede. I'd say a non-discerning, non-picky eater wouldn't really be able to tell the difference. Whereas you can absolutely tell the difference between Cento/Sclafani D.O.P./La Fede D.O.P. vs. domestic tomatoes distributed by Muir Glen, Jersey Fresh, Bianco diNapoli, etc."
Cooking,"I know I said I was looking at making meatloaf this weekend, but a winter storm had me housebound all weekend, and I decided something going low and slow on the stove would be best.

So, I made spaghetti and meatballs! I come from a family of great cooks, and everyone is pretty critical, so it’s only been in the last few years I’ve started cooking for myself. Today was a huge milestone for me, cooking-wise, as I altered a recipe.

I know, I know, doesn’t sound like much, but for the last 18 months or so, as I’ve made stuff, I’ve looked at the recipe and thought it could be improved, but I’ve been nervous about going off-book. 
Today, I finally trusted my gut, read about 15 different recipes, and I combined what I liked from them. And it paid off! It wasn’t the best spaghetti and meatballs, but it was definitely fine, and I won’t mind eating the leftovers.

My mother hates meatball, so I’ve never even seen someone make them before, but they turned out, and I am so excited.  I think next time I’ll make some adjustments, but for my first attempt, it went pretty well. 

I wanted to post about it because all of the beautiful posts really inspired me, and I appreciate it."
Cooking,"So basically I read you gotta eat your protein 30 mins after workout if you wanna min max  but lentils gotta boil for 5-10 minutes and it seems really annoying having to do that after each workout when youre sweating and shit. Can I just cook up a big pot of lentils to last an entire week and then put it in the freezer or nah?

&amp;#x200B;

Thanks, any help is appreciated"
Cooking,"I’m trying my best to replicate my grandmother’s roast recipe, and I don’t know much about it, but I’ve never been able to really get it.

All I can say for sure is that she seared it before hand (no big surprise there) and she put garlic cloves into the meat.

But when it was done it was super, fall-apart tender, and absolutely infused with garlic flavor in every bite.

The only time I’ve personally tasted anything like it is, very randomly to me, at the Iraqi-Jewish restaurant Azura in Jerusalem’s main market, where they serve a “beef sofrito” that is cubes of beef instead of a whole roast.  And damn if it doesn’t taste just like my grandmother’s.

In any event, does anyone have any idea for how to achieve the garlic-in-every-bite, fall-apart roast?  I don’t even know what cut of beef.  And every time I try, even absolutely bombarding the thing with garlic cloves, I get barely any garlic flavor."
Cooking,"I don’t want to have to buy any special tools but is there a way using ordinary kitchen things to beat an egg and then hard-cook it out of the shell so it has the same firmness as a hardboiled egg but with the white and yolk blended?

**EDIT:** I just got decent results by steaming the egg in a ramekin."
Cooking,I think I like cooking.
Cooking,"I have a friend who does it all the time and I decided to give it a shot last night. I couldn't tell you the last time I roasted a whole bird, as I've always felt like it didn't turn out well, like I always overcooked it. But spatchcocking is a game changer. This was literally the best roast chicken I've ever done, and the breast meat was so incredibly moist. Holy crap! And it was so easy!

Preheat oven to 425, line a sheet pan with parchment.

Halve small golden potatoes, slice onions and carrots (I didn't have carrots last night but will the next time), toss with a little olive oil  and salt and pepper and add to sheet pan in a single layer.  You could also add garlic and fresh herbs to the veg.

Flip the bird over and, using kitchen shears, cut along both sides of the spine to remove it.  Then, using a sharp knife, score the breast bone.  Place bird breast side up on top of the veg and press down on the breast bone until it breaks to flatten everything out. 

Brush skin with olive oil and season with salt and pepper and put in the middle rack of the oven. Cook for 45 minute and then check doneness with an instant read thermometer in the breast/thigh, sticking it back in for a few minutes if it's not 165. 

This was so easy and so good.  

[https://imgur.com/ODWKkP7](https://imgur.com/ODWKkP7)"
Cooking,I don’t know how to cook. I cook eggs and sometimes grill chicken but that’s it.  I never know when the meat is finished and I’m not confident in my abilities. What’s the best way to learn how to cook ?
Cooking,"Hey r/cooking, for Christmas my father received a trip on a chartered fishing boat, and he came home with a 40cm bonito! it has been cleaned and scaled for us, and we're having the family over for grilled fish and chips, so most of the fillets are spoken for. But we've frozen the head and tail, as Mum thought it make for a good bouillabaisse. I've never cooked bouillabaisse, but all the recipies I've googled call for white fish, nothing near the  flavor profile of tuna, so I'm not sure if that will be the best use for it. 

I was hoping you could recommend how I use this to make a stock, and what sorts of dishes would go well with a tuna-y stock? I'm a homebody right now so simmer time isn't an issue, I'll be here to watch it."
Cooking,"I have read lots about how long to cook a egg to get the consistency you want and it is quite accurate, but the biggest problem for me is peeling the egg. I have read some ideas and have tried most but with no luck. 

Some of the things I have tried include 
1: Using old eggs 
2: Poking a small hole in one end of the egg 
3: Using ice bath to ""shock"" the egg (this works great for getting the desired donenss but did not help the peeling)

Anyone have a sure-fire method they have used to make the easiest peeling egg?"
Cooking,Does anyone have a great chocolate chip cookie recipes? Looking to spend my afternoon in the kitchen 🌻🌻
Cooking,"Hi everyone and thanks for reading. I haven’t made chili in a long time and this batch is way too “tomatoey”, not sure if that’s a word. But what can I do to help? I just added beef stock and I’m attempting to cook it down a bit-will that help? Anything else?

Edit to add update: YOU ALL ROCK! Thank you everyone! I was able to fix it and it turned out fantastic. Much appreciated!"
Cooking,Okay so I did a side by side comparison with my Idaho russets cooked in peanut oil at 350 precook and then 350 final cook. I followed every step exactly from soaking the fries first and drying them.  But the test had a drastic taste difference between mine and five guys’ fries. Five guys fries melt in your mouth and taste very buttery. Why do you think mine didn’t taste buttery? I’m going to do more tests at 275F which is the temp I used to precook them at. It’s driving me crazy!
Cooking,"hey
i know its a bit early, but for valentines day this year i want to make something for a good friend of mine. he isn't too big on sweets, but he likes white chocolate. any suggestions on what i could make?
i was thinking of white chocolate truffles but i live in the philippines so i'm afraid it's going to melt easily. a friend suggested white chocolate covered sugar cookies but i don't have an oven ;__;

any ideas?"
Cooking,"All I'm reading is that they are simply dehydrated. When I buy something in the store, is it actually dried in the sun, and if it is, is there anything beneficial?"
Cooking,So I cooked some rice last night and fried some veggies and seasoning to stir into it for tonight's tea. My husband said he'd 'sorted it'. I didn't know that by that he meant he'd just left it uncovered in the bloody microwave so I'm not happy to say the least. We live in the UK so it's quite cold here but would this still be ok to eat if I put it in the fridge now?
Cooking,"So my wife started a new diet today (Keto) and she's counting the calories and all of that. 

I used to make scallops in butter and they were always really tasty. Tonight however, they didn't have that nice buttery taste I am used to. My wife agreed. They were good but not great. I know diets suck especially if you're a food lover like my wife is. 

Is there anything other than butter or olive oil I can cook those in that she can eat on her diet? Neither one of us care much for anything spicy so adding pepper or anything like that would be a huge turn off."
Cooking,"I've been following a diet where I've cut gluten and rice products due too food sensitivities. I can eat these foods and I'll be fine but I actually feel better not eating them so I tend to stay away. However, I do miss bread crumbs and was wondering what are some tasty substitutes I can use instead of bread crumbs. Any ideas?"
Cooking,"Grabbed some frozen Mahi Mahi filets at the grocery store. Can I treat it more or less like Cod, in terms of cooking? And will it work with spanish-y flavors (which i’ve been super into lately)?"
Cooking,"I was watching an episode of Good Eats and Alton was making chicken parm. He crushed up some salt and vinegar potato chips and put that in the breading.

Well I'm making some chicken cutlets today and have some salt and vinegar chips laying around. I normally make my chicken cutlets just by dipping the chicken in an egg wash and then some Italian bread crumbs.

I'm thinking of adding salt and vinegar chips to this today. Maybe pulsing them in my blender for a minute and mixing with the bread crumbs about 50/50? Think this would be a good idea? Have you done this?"
Cooking,"So, I have the most patient husband in the universe who, when I say things like ""can I make you savory oatmeal for breakfast?"" apropos of nothing, doesn't even bother asking what I'd do to it and says sure why not.

So for the last month, on Saturdays I get up before him. He cuddles in bed with the pup or folds laundry or whatever, and I get to go fiddle around in the kitchen with steel cut oats and whatever else I can find in the fridge and pantry.  I have made some wacky concoctions using just what we have, and God love him, he eats all of them. Dried peaches and chipotle chilies with almond butter and smoked paprika; sautéed apples, black pepper, fontina, and broccoli rabe; crispy turkey bacon with red wine balsamic reduction, rosemary, feta cheese, roasted figs, caramelized onions, and 88 percent dark chocolate shavings. 


This week, it was a spin on African peanut stew. Deeply roasted cherry tomatoes with red wine vinegar, toasted steel cut oats cooked in stock and tomato paste, spinach with ginger, cilantro, lemon, spiced shallots and red onion and jalapeno/serrano chilies, spicy candied peanuts.

It's DELICIOUS. I just wanted to tell you all."
Cooking,"So, I need ideas for meals I can easily make daily. I work 2-10 and I’m to tired to cook when I get home. But I wanna work on that. But I need ideas on meals I can quickly and easily make when I get home. I prefer hot meals with a good amount of meat. I’d also like some balance with vegetables too, as I’m trying to have a better diet.
Not into cheese at all really.
Some spice is good too I actually like as spicy as possible. 


Thanks for any help in advance and I apologize if this isn’t allowed."
Cooking,"I'm a fan of green smoothies for breakfast and would normally use something like kale or spinach, but I saw and bought a really beautiful bunch of escarole this morning and after tasting it, starting wondering if it would work as a substitute as it's a little bit more hardy and bitter than a head of romaine for instance."
Cooking,"I found a recipe for Carbonnade Flamande I want to try, but it says to put the stew in the oven at 320F for two hours. I'm not sure how long this would be if I wanted to simmer on the stovetop instead.

Edit: Thanks for the advice. Also, I am planning on trying the recipe from [bbcgoodfood](https://www.bbcgoodfood.com/recipes/1236/carbonnade-flamande)"
Cooking,"I picked up some frozen beef bones recently and they appear to be beef carpal joints...would they be good to make stock from? I have searched the internet, but have not seen anything on these bones or are these bones considered ""knuckle bones"" ?"
Cooking,"So, my mom is a great cook when it comes to Korean food, but she has no idea what she's doing with other cuisines. One day she was craving pasta, so she bought some ingredients. I was over at my parents' house and noticed a jar filled with red stuff and I asked her what it was. She said it was tomato sauce, for spaghetti. I looked closer and it was a 1.5lb jar of tomato paste!! So I told her that if she tried to make spaghetti with that as a pre-prepared jarred sauce, she'd be really sad.

I ended up making a different pasta dish for them and my grandma (shrimp with garlic lemon cream sauce), but she gave me the huge thing of tomato paste to use up. What do I do with it?! I struggle to use up a small can before it goes bad, I don't know what to do with a pound and a half of it! I know I can freeze it into tablespoons, so I'll probably do some amount of that, and maybe give some of it away that way as well. But does anyone have ideas on how to use up significant amounts of it? I'm a pretty able cook, though I stay pretty frugal and lately have been doing a lot of soups and that sort of thing. I'm also maintaining a sourdough starter and always looking for ways to use up discard, in case there's a recipe that incorporates both. Help me, Reddit! You're my only hope!"
Cooking,"This may seem like a dumb question but here in the northeast, do different stores get different ""grades"" of fruit (even though all of them are Driscoll's branded)? Are there contractual differences (i.e. does Target know they are getting crappier fruit, but are able to buy and resell it at a cheaper cost)? Is there any way a shopper can tell?

* Whole Foods: always seemingly top notch
* Chain supermarket (Big Y, Stop &amp; Shop): middling, varies depending on season
* Chain department store (Target, Walmart): varying to low quality"
Cooking,"I need to do a deep clean of a coffee grinder which I've repurposed as a flaxseed grinder. I let a friend borrow it for a couple of weeks but he didn't clean it and now I have dried, caked on flaxseed.  

I've tried using soap, water and some elbow-grease, but it hasn't removed much of anything. Does anyone know how best to clean this? Not just the metal base, but also the plastic cover.

Thanks in advance for any help.

If this isn't the right place to post, I'll delete."
Cooking,"Basically what the title says. A lot of recipes call for freezing fruit by freezing them on a parchment paper  lined baking sheet and then moving it into an airtight bag, but I don't really have space in my freeze to do this. Can't I just cut up the fruit and put it in a bag to freeze it?

I intend on using the frozen fruit for smoothies if that helps."
Cooking,Title says it all. Plus I’m curious but don’t want to waste food by experimenting at home
Cooking,"I’ve been through four attempts at making chicken stock at home now, and I might just be ready to quit. The stock always comes out smelling terrible, as opposed to the yummy, chicken-y smell described by most recipes. 

I start by breaking down an entire chicken manually. I roast the bones in a convention oven until they are a deep golden brown color. I drop the bones into my Instant Pot along with onion, carrot, and celery, and bring the stock up to a boil (No seasoning). After 3 hours, my stock comes out a beautiful golden color, but smells like hell (At least to me).

My problem might be that I’m not removing scum. However, when I bring the soup to a boil, I don’t notice any significant amount of scum rising to the top at all, so I just place the lid on my InstantPot and set the device to “Soup”.

Is there any way for me to make a good stock? Pls help."
Cooking,me and my sister bought way too many packs of crab sticks yesterday and im at a loss of what to do with them. do y’all have any recipes/suggestions?
Cooking,The title says it all. I’d like to prepare a lasagna (and I make my own lasagna macaroni) and layer it. But I’d like to let it sit for a few days. Is that possible with a normal lasagna? Should I put it in the freezer? The freezer scares me a little bit because I won’t know thaw time or how it would affect my cook time.
Cooking,"I'm talking specifically about the gravy/sauce. I made it with homemade chicken stock, garlic, onions, rosemary, salt and pepper. It was delicious! I mixed in the chicken, some peas and carrots; tasted it again. Still delicious. But whenever it comes out of the oven, pie dough on top and bottom, it always ends up kinda bland. It's warm and comforting, but the delicious gravy is very muted, like it lost most of its flavor.

Why? What's going on here?"
Cooking,"Bought for a birthday present as a part joke because I LOVE jalapeños! :) But the tin says they need to be used within a week of opening. I can use some for the usual Mexican meals that I enjoy having but that leaves me with... well, absolutely loads! I was thinking of making a jalapeño jam, perhaps. Any other better ideas??"
Cooking,"My friend said that using any other meat like turkey or vegetables in place of ground beef means it is not a lasagna anymore.  Said there's a culinary law, said codex, on how you make dishes like lasagna.  If you alter any part of the dish it is not a lasagna anymore.  My mom doesn't eat red meat or pork, so when she makes lasagna she uses ground turkey.  Base off what my friend says this is not a lasagna anymore then what is it? 

I find this dumb as lasagna calls for meats but does not specify what kind.  It is just tradionally people ground beef used right?"
Cooking,"Hi Bakers!

I noticed that rarely are there any baking subscriptions available for us bakers. For example, we have ""Netflix"" for those who loves to watch movies/drama for a small monthly subscription fee. Nothing when it comes to baking.

Curious to hear what type of baking related subscriptions would you pay to join?

For me, personally I would pay a small monthly subscription fee for access to different home-made gluten free dessert recipes.

Lucky"
Cooking,"I recently acquired a lovely set of heavy baking pans in the same style as [these](https://www.nordicware.com/bakeware/2-pack-naturalsr-baker-s-quarter-sheet) but they discolour so easily.  Today I threw a baked potato wrapped in foil onto one of them because it was already in the oven and now my pan is covered in yellow, sticky residue.  The edges are dark brown on the inside and not even a soak with baking soda/vinegar/hot water could lift the stains. 

I tried scrubbing with an OXO pad as well as wiping with magic eraser.  Is there a magic trick I'm missing for maintaining these pans? I'd like them to look clean for as long as possible!"
Cooking,"I forgot to buy a lemon for my recipe ): I literally just came back from the store and I bought all my other ingredients for my hollandaise sauce...

Would it be crazy to make hollandaise without lemon/lime?"
Cooking,"So I am not no-carb, but I look for ways to lower my carb intake because I don't like my doctor chiding me about how I am going to lose my feet. I recently discovered the korean radish at our local international grocery store, and decided to make lower-carb home fries with them as a potato replacement. They are pretty tasty, and while they don't kill your starch cravings (kinda the point), they make good home fries. I have not tried mashing them (I use parsnips for that, though they are only a bit lower-carb), but I have included them in some slow-cooked stews and whatnot to replace potato. I am considering using potato peels in stews and chowders to give the earthy potato flavor without all the starch, but then I would have a bunch of potatoes without clothes on, and no use for them.

Anybody got any ideas? It staggers me to think of how many potato peels get thrown out every day when it has all that flavor attached. Any other ideas for what to do with these enormous radishes?"
Cooking,"I've only ever used store brand cream butter.  Is this a reason to use a more expensive butter, what would I look for in a brand, and when should or shouldn't it be used?

Thanks in advance :)"
Cooking,"I work in a professional kitchen, and I have since fell in love using the gas cooktop. However, I will be moving into a rental home with an electric stovetop and I just can’t get behind it anymore. Is it worth it to invest in a propane/butane portable cooktop?

Any advice or recommendations if it is worth it?

I cook at home roughly 3-4 nights, and cook breakfast most every day for context in amount of use.

ETA: Would an induction cooktop be better value? How well can you control heat with one, for those who have them?"
Cooking,"So, i received a grinder for Christmas... I went to Costco. Bought some roast, and didn't realize the chuck roast costs more than the ground stuff... It's a lot of clean up to grind your own meat, why does it cost more to grind your own vs buy it preground?

Note. i don't like Costco hamburger, so i likely won't be buying it there again, other stores all want like $5 a pound for chuck roast...  so disappointing, hell brisket is cheaper here than chuck."
Cooking,Like you know how Pizza Hut has either the flat or fluffy pizza on the bread crust and I am making pizza. Do I need baking soda?
Cooking,I was thinking of making fries chicken tomorrow since i had all the ingredients in the pantry but only had rice as a side which was kind of meh since ive eaten rice twice this week. What are your favorite things to accompany fried chicken with? Anything that someone could make in an hour or so? Thanks!
